{
  "$schema": "../../Contracts/v1/profile.schema.json",
  "schemaVersion": "1",
  "documentKind": "profile",
  "id": "framework-chronicle-typescript",
  "version": "1.0.0",
  "description": "Framework contribution pack for the idiomatic Chronicle TypeScript client; React is not implied.",
  "activation": "automatic",
  "priority": 100,
  "repositoryModes": ["framework"],
  "detect": {
    "allOf": [
      {"kind": "repository-identity", "id": "cratis-chronicle-typescript"},
      {"kind": "file", "pattern": "**/*.ts"}
    ]
  },
  "provides": ["chronicle-client-framework", "chronicle-client-typescript", "framework", "repository-known", "typescript"],
  "excludes": [],
  "skills": ["cratis-specs-typescript"],
  "recommendations": {
    "agents": [
      {
        "id": "repository-investigator",
        "purposes": ["investigate"],
        "priority": 100,
        "rationale": "Investigates TypeScript SDK behavior without inventing React or Arc integration."
      },
      {
        "id": "repository-investigation-reviewer",
        "purposes": ["review"],
        "priority": 100,
        "rationale": "Independently reviews typed investigation evidence using the resolved repository mode."
      }
    ],
    "workflows": [
      {
        "id": "investigate-cratis-issue",
        "purposes": ["investigate"],
        "priority": 100,
        "rationale": "The client framework can use the read-only repository workflow."
      }
    ]
  },
  "commands": {}
}
